{
  "id": "github",
  "name": "GitHub",
  "provider": "GitHub (Microsoft)",
  "website": "https://github.com",
  "category": "Developer tools / source control",
  "summary": "GitHub is self-serve: register a GitHub App (preferred) or OAuth App in your account or org settings in about 15 minutes, with no app review, fee or user cap. Flip the GitHub App to 'Any account' (public) and anyone can install it the same day. What decides your rollout is org-level friction, not GitHub approval: each customer org has to install or approve your app, and SAML-SSO orgs need users to reauthorize with an active SSO session.",
  "verdict": {
    "difficulty": 2,
    "label": "Self-serve",
    "headline": "GitHub has no app review or verification. The only gate is that each customer org's owner has to install your GitHub App (or approve your OAuth App) before the agent can reach private org repos."
  },
  "timeline": {
    "first_connection": "15-30 minutes",
    "production": "Same day for personal accounts. For each customer org, it depends on when their owner installs or approves the app (minutes to weeks, set by the customer, not GitHub).",
    "hands_on_effort": "1-3 hours: register the app, choose permissions, build the callback and refresh handling, and test with your own account plus a test org",
    "wait_detail": "GitHub has no provider-side wait. The variable waits are customer org owners installing the GitHub App or approving the OAuth App (with OAuth App access restrictions on, the default for new orgs), and enterprise security reviews on the customer's side. A GitHub Marketplace listing (optional) and publisher verification (needed only for paid plans) have their own review, with timing undocumented.",
    "first_connection_short": "15-30 min",
    "production_short": "Same day",
    "hands_on_short": "1-3 hours"
  },
  "approval": {
    "needed_for_production": false,
    "type": "none",
    "trigger": "No GitHub review for any scope or permission. Optional: a Marketplace listing, and publisher verification if you sell paid plans through Marketplace.",
    "what_happens_without_it": "Nothing. A public GitHub App gets an install page anyone can use. The real limits are per org: private GitHub Apps can only be installed on the owning account, and OAuth Apps get no API access to private org resources until an org owner approves them (OAuth App access restrictions are on by default for new orgs).",
    "cost": "Free. Only Marketplace paid plans involve verification and financial onboarding.",
    "evidence": "official",
    "source_ids": [
      "s3",
      "s4",
      "s5"
    ]
  },
  "managed_option": {
    "composio_managed": "yes",
    "when_you_need_your_own": "Composio's managed GitHub auth shows Composio's name on the consent screen and shares its quota across all Composio users. Use your own app for your branding, custom scopes/permissions, a dedicated rate limit, and so enterprise customers' org owners approve an app named after your product."
  },
  "prerequisites": [
    {
      "item": "A GitHub account, ideally an organization you own to hold the app",
      "why": "Org-owned apps survive staff changes. They also get the 15,000/hr rate limit if the org is on Enterprise Cloud."
    },
    {
      "item": "An HTTPS callback URL (or http://127.0.0.1 for local dev)",
      "why": "redirect_uri must match a registered callback URL. Loopback can use any port."
    },
    {
      "item": "A homepage URL",
      "why": "Required field. A repo URL is acceptable."
    },
    {
      "item": "A test organization",
      "why": "To reproduce the org install/approval flow and the private-repo visibility your customers will hit."
    }
  ],
  "phases": [
    {
      "name": "Create the app",
      "goal": "Register a GitHub App with least-privilege permissions",
      "duration": "15-30 minutes",
      "steps": [
        {
          "title": "Decide GitHub App vs OAuth App",
          "detail": "Choose a GitHub App for an agent: fine-grained per-repo permissions, the user picks repos at install, and it isn't subject to OAuth App access restrictions. Use an OAuth App only if you need enterprise-level access or broad 'act as the user everywhere' scopes like repo.",
          "owner": "agent+you",
          "effort": "10 min",
          "evidence": "official",
          "source_ids": [
            "s1"
          ]
        },
        {
          "title": "Sign in and open Developer settings",
          "detail": "Use Settings > Developer settings > GitHub Apps > New GitHub App, or the org equivalent at /organizations/<org>/settings/apps/new. It redirects to login when you aren't signed in.",
          "owner": "you",
          "effort": "2 min",
          "url": "https://github.com/settings/apps/new",
          "evidence": "tested",
          "source_ids": [
            "s3",
            "t4"
          ]
        },
        {
          "title": "Fill registration fields",
          "detail": "Name (at most 34 chars, globally unique), homepage URL, up to 10 callback URLs, keep 'Expire user authorization tokens' checked, optionally 'Request user authorization (OAuth) during installation', and Webhook (deselect Active if unused).",
          "owner": "agent+you",
          "effort": "10 min",
          "evidence": "official",
          "source_ids": [
            "s3"
          ]
        },
        {
          "title": "Select permissions",
          "detail": "A typical agent set: Contents R/W, Issues R/W, Pull requests R/W, Metadata R (mandatory), plus Actions/Checks R if needed. Choose the minimum, because every permission is shown to the installer and widening it later forces each installation to re-approve.",
          "owner": "agent+you",
          "effort": "10 min",
          "evidence": "official",
          "source_ids": [
            "s3"
          ]
        },
        {
          "title": "Set 'Where can this GitHub App be installed?' to Any account",
          "detail": "'Only on this account' (private) blocks outside users. Public needs no review.",
          "owner": "you",
          "effort": "1 min",
          "evidence": "official",
          "source_ids": [
            "s4"
          ]
        },
        {
          "title": "Generate client secret (and private key if you'll use installation tokens)",
          "detail": "Store them in your secret manager. Never ship the client secret in client-side code.",
          "owner": "you",
          "effort": "5 min",
          "evidence": "official",
          "source_ids": [
            "s2",
            "s7"
          ]
        }
      ]
    },
    {
      "name": "Configure & test",
      "goal": "Complete a real user connection and token refresh",
      "duration": "1-2 hours",
      "steps": [
        {
          "title": "Implement the web flow with PKCE S256",
          "detail": "Send users to https://github.com/login/oauth/authorize with client_id, redirect_uri, state, code_challenge and code_challenge_method=S256 ('plain' is rejected). Exchange the code with a POST to https://github.com/login/oauth/access_token, sending Accept: application/json (otherwise the response is form-encoded).",
          "owner": "agent",
          "effort": "30-60 min",
          "evidence": "official",
          "source_ids": [
            "s2",
            "s6"
          ]
        },
        {
          "title": "Handle refresh",
          "detail": "Access tokens (ghu_) last 8h and refresh tokens (ghr_) 6 months. Each refresh rotates both, so persist the new refresh token atomically. On bad_refresh_token, send the user back through the flow.",
          "owner": "agent",
          "effort": "30 min",
          "evidence": "official",
          "source_ids": [
            "s2",
            "s6"
          ]
        },
        {
          "title": "Install on your account and a test org, then connect",
          "detail": "Confirm the agent sees only the repos selected at install. Call GET /user/installations to check which orgs the token can reach.",
          "owner": "you",
          "effort": "15 min",
          "evidence": "official",
          "source_ids": [
            "s2",
            "s9"
          ]
        },
        {
          "title": "Disable wildcard redirect matching",
          "detail": "Since August 2026 the per-URI wildcard toggle is visible. Apps that had a single callback URL before 2026-08-03 have it on (legacy behavior). Turn it off unless you control every subdomain and path.",
          "owner": "you",
          "effort": "2 min",
          "evidence": "official",
          "source_ids": [
            "s8",
            "s6",
            "s13"
          ]
        }
      ]
    },
    {
      "name": "Roll out to customers",
      "goal": "External users and orgs connect without friction",
      "duration": "Same day for you. Per-org timing is set by the customer.",
      "steps": [
        {
          "title": "Share the public install link",
          "detail": "https://github.com/apps/<slug>/installations/new. No GitHub review is involved.",
          "owner": "agent",
          "effort": "5 min",
          "evidence": "official",
          "source_ids": [
            "s4"
          ]
        },
        {
          "title": "Org owners install the app (or approve the OAuth App)",
          "detail": "Members can request it, and owners are notified. For OAuth Apps, unapproved apps get no API access to private org resources.",
          "owner": "provider",
          "effort": "customer-dependent",
          "evidence": "official",
          "source_ids": [
            "s5"
          ]
        },
        {
          "title": "Optional: Marketplace listing and publisher verification",
          "detail": "Only needed for discovery or paid plans. Paid plans require an org-owned app, a verified publisher and financial onboarding.",
          "owner": "you",
          "effort": "hours + undocumented review",
          "evidence": "official",